region_key,region_name,state_name,entrepreneurial_activity,proprietors_per_1000,establishments_per_1000,telecommuter_pct
13_1,Northwest Georgia Regional Commission,Georgia,0.002793669711900772,2834.944034172159,17.195912477340176,75.91507171272528
13_10,Southwest Georgia Regional Commission,Georgia,0.00330924447007832,2115.837832744674,20.569281417121843,68.1721069088954
13_11,Southern Georgia Regional Commission,Georgia,0.002988038231504452,1879.9039404603934,19.832112156003,70.0615566529874
13_12,Coastal Regional Commission of Georgia,Georgia,0.0039869799546915505,2761.3932211799283,22.554720447959347,67.73204054649625
13_2,Georgia Mountains Regional Commission,Georgia,0.003795621034730852,3541.5351723461313,22.493704624239648,73.92376834679713
13_3,Atlanta Regional Commission,Georgia,0.006183294768748483,5184.580545921404,28.03747732211015,75.69903728024109
13_4,Three Rivers Regional Commission,Georgia,0.003707354056103108,2068.174753601213,18.898786959818047,75.284507138233
13_5,Northeast Georgia Regional Commission,Georgia,0.003608533048274321,3128.3792251165983,19.86354007660961,70.15848223650029
13_6,Middle Georgia Regional Commission,Georgia,0.0033632023330746256,1818.5027085930212,19.86758860744608,67.03930266662402
13_7,Central Savannah River Area Regional Commission,Georgia,0.003036468290887528,2763.192278987026,18.519389434726154,66.70093877796766
13_8,River Valley Regional Commission,Georgia,0.0033024377995392964,1534.5063810740292,19.293332896647343,63.786907378540725
13_9,Heart of Georgia-Altamaha Regional Commission,Georgia,0.0026960584576100834,1423.624127346318,17.700948034661668,69.00796390922063
21_1,Barren River Area Development District,Kentucky,0.0027490772551373582,3473.0073181011253,18.279288368944684,72.70749122769095
21_10,Kentucky River Area Development District,Kentucky,0.002284721632159817,1529.7910707036376,13.604478809678913,62.152549465000895
21_11,Lake Cumberland Area Development District,Kentucky,0.002612567366570728,3873.1335355135316,18.268654986574976,70.43847241867044
21_12,Lincoln Trail Area Development District,Kentucky,0.002925754101565972,3193.8783128032846,18.027337848166518,69.20300141959035
21_13,Northern Kentucky Area Development District,Kentucky,0.0030606673321218634,3437.0611621577814,19.332326619061025,75.56185402237614
21_14,Pennyrile Area Development District,Kentucky,0.002480487145295001,3220.5255648703337,17.680464764959854,63.798067991826116
21_15,Purchase Area Development District,Kentucky,0.003706530033794833,5912.339353416427,24.449774095473433,73.25289944347678
21_2,Big Sandy Area Development District,Kentucky,0.0031457807842238017,1758.8210846136208,17.226553542765423,66.9983648680215
21_3,Bluegrass Area Development District,Kentucky,0.003720713493050985,3659.8513636210782,22.190969403196597,68.3718910622141
21_4,Buffalo Trace Area Development District,Kentucky,0.002273174748071381,2882.2602874581607,15.607940002505863,70.58713886300093
21_5,Cumberland Valley Area Development District,Kentucky,0.0024212969616207013,1881.6308044715606,15.677462341428999,67.48734941306414
21_6,FIVCO Area Development District,Kentucky,0.0026344774208912573,1957.5804483076831,17.168755395469294,67.50210970464136
21_7,Gateway Area Development District,Kentucky,0.002585037196462827,1881.485986992935,16.58634726056239,68.11237661351556
21_8,Green River Area Development District,Kentucky,0.0031784218927109116,3558.6990214902034,20.643549469106386,72.83152826639173
21_9,Kentuckiana Regional Planning and Development Agency,Kentucky,0.004119004782665725,4172.15443135612,23.723431538185952,75.25002995566561
24_1,Tri-County Council for Western Maryland,Maryland,0.0035682780872757906,3120.5704476639303,23.18188681644428,67.50171303275319
24_2,Mid-Shore Regional Council,Maryland,0.004172300560169983,4243.673942437705,26.19277573884489,64.30608666258213
24_3,Tri-County Council for the Lower Eastern Shore,Maryland,0.004224715135069548,3545.2640171194726,27.63713778307246,66.53812278321313
24_4,Upper Shore Regional Council,Maryland,0.003279898086822188,3620.5002276906403,21.49514932470991,66.6730010926885
24_5,Tri-County Council for Southern Maryland,Maryland,0.003017966120723991,1857.1959379084878,17.24972132598044,54.862857262593245
37_1,Southwestern Commission,North Carolina,0.0043902893666701,3275.499242123232,24.987859255662002,67.95088058697934
37_10,Upper Coastal Plain Council of Governments,North Carolina,0.003061764614304149,2183.190393324315,20.07618085514913,73.54759779122442
37_11,Mid-Carolina Council of Governments,North Carolina,0.0028323526855389405,1974.8470453970017,16.38758828664392,59.076678996843924
37_12,Lumber River Council of Governments,North Carolina,0.002448055436377599,1711.1402746581196,15.236350919192539,70.63453540054631
37_13,Cape Fear Council of Governments,North Carolina,0.00494301169748935,4368.321000095779,27.496803907769316,71.39310943058446
37_14,Eastern Carolina Council of Governments,North Carolina,0.0031287922673461153,2800.39781031638,19.105570443352846,56.78195272254916
37_15,Albemarle Commission,North Carolina,0.0044329004329004325,4995.070707070707,27.901875901875904,63.660317215495745
37_16,Mid-East Commission,North Carolina,0.003565891472868217,3269.872002884442,21.575626464755725,66.79803597456213
37_2,Land of Sky Regional Council,North Carolina,0.006111750589720363,4950.1751565965815,30.983306202791155,72.32030112292142
37_3,Isothermal Planning & Development Commission,North Carolina,0.003130829253767942,2372.170212020633,19.66948952157426,73.20137078462703
37_4,High Country Council of Governments,North Carolina,0.0038880063353035747,3789.9283938955914,23.194462334044147,67.81970181281713
37_5,Western Piedmont Council of Governments,North Carolina,0.0029888178870095703,2666.279632053023,21.031005570566425,75.17552138833916
37_6,Centralina Regional Council,North Carolina,0.005190538254719788,6550.6102278833905,26.522421313855265,78.09468102035638
37_7,Piedmont Triad Council of Governments,North Carolina,0.0035107603343101043,3765.0993636281332,21.75960889430818,73.52574512204262
37_8,Triangle J Council of Governments,North Carolina,0.004928660678021634,4867.267857610222,25.394549732023158,70.83489365696121
37_9,Kerr-Tar Council of Governments,North Carolina,0.003039776535346591,2346.923685610139,16.837681121820236,72.42421250123432
42_1,North Central Pennsylvania,Pennsylvania,0.003347141060729344,4623.571454989275,24.423958872697686,69.66385040229824
42_2,Northwest Pennsylvania,Pennsylvania,0.0031200085343558973,3396.1709384722626,22.72272257644021,69.46057897700955
42_3,Southwestern Pennsylvania,Pennsylvania,0.004019035077410495,5629.721138691725,24.79679443114515,70.93689962324409
42_4,Northern Tier,Pennsylvania,0.003529398083542655,3357.1553167736533,22.007861196390362,70.39837006058656
42_5,Southern Alleghenies,Pennsylvania,0.003238636102994133,3264.242429802792,22.571825700825254,70.97282600186831
42_6,SEDA-COG,Pennsylvania,0.003402590066193182,4048.2860458683776,20.970199164938542,66.70066735740625
42_7,Northeastern Pennsylvania,Pennsylvania,0.003571296507135781,3669.7698995171454,21.254566296692023,73.05400213447172
45_1,Appalachian Council of Governments,South Carolina,0.003861425100617512,3000.2776433870085,22.76600531359783,74.7329924530205
45_10,Waccamaw Regional Council of Governments,South Carolina,0.004924055151191329,4418.682144591188,27.236387902920068,74.51170843978969
45_2,Berkeley-Charleston-Dorchester Council of Governments,South Carolina,0.005075939945083259,4527.362527663749,26.545995882489127,68.49277202943483
45_3,Catawba Regional Council of Governments,South Carolina,0.0033505558876813653,2526.1759337344606,18.96905622978358,77.19027980335532
45_4,Central Midlands Council of Governments,South Carolina,0.0038082637767444276,3423.0778709522606,22.828829179394386,65.48840489212351
45_5,Lowcountry Council of Governments,South Carolina,0.0049208960524122535,4033.888232608365,27.633838951175147,67.52689253884012
45_6,Lower Savannah Council of Governments,South Carolina,0.0026143917267880054,2220.456728754441,17.67535121822273,70.72850803126104
45_7,Pee Dee Regional Council of Governments,South Carolina,0.0029240480056649614,1893.1196356843739,18.978841857228318,71.73914668700144
45_8,Santee Lynches Regional Council of Governments,South Carolina,0.0027800894384036436,2089.8453575249887,16.593658835471746,63.935061627224506
45_9,Upper Savannah Council of Governments,South Carolina,0.002144729893736277,1970.751998814145,15.221560325739539,73.31853645412967
47_1,First Tennessee Development District,Tennessee,0.002876279471736841,4523.083541353993,18.08718734205541,71.23008513191095
47_2,East Tennessee Development District,Tennessee,0.0032676166988993374,7737.861271218522,20.522786993523372,71.83528064706437
47_3,Southeast Tennessee Development District,Tennessee,0.0036301862214998867,5206.624977301956,21.3128998419766,71.49145716097199
47_4,Upper Cumberland Development District,Tennessee,0.0027364729597260766,5728.788192574798,17.178202101368235,71.51763589392102
47_5,South Central Tennessee Development District,Tennessee,0.0026478640491984697,5290.7598749060835,17.349181987674697,72.56175972927242
47_6,Southwest Tennessee Development District,Tennessee,0.0032656080952077897,4178.232196270604,20.190288296315153,70.17052907739397
47_7,Northwest Tennessee Development District,Tennessee,0.002883574497856228,5037.963912774236,17.925433599788224,70.43349388662467
47_8,Greater Nashville Regional Council,Tennessee,0.0044572851472419175,14973.17217136125,23.15293420414328,71.41101625593052
47_9,MidSouth Development District,Tennessee,0.003730964827883654,4952.175211264936,20.487129782786944,71.77421716485034
51_1,Southwest Virginia,Virginia,0.0027577572040335574,1538.5473962425888,18.832081728914087,68.87102456983024
51_2,Central/Western Virginia,Virginia,0.003791740607736318,2258.6523480970395,24.018004840442316,68.43718079673135
51_3,Southside Virginia,Virginia,0.0029044215997248444,1392.9524450854562,19.555710846267655,69.81209626042101
51_4,Greater Richmond,Virginia,0.004423403657449537,5412.98303944313,24.003059350278857,69.44040426642799
51_5,Hampton Roads,Virginia,0.003905086919676599,1763.9309185587038,22.070612216852567,59.75610732650388
51_6,Mary Ball Washington Regional Council,Virginia,0.004174426217217433,4313.023093144775,22.79065346237728,63.674754714129975
51_7,Northern Virginia,Virginia,0.00492579384125112,6049.898552219815,26.06595800089964,62.713262947267175
51_8,Shenandoah Valley,Virginia,0.0036915519481467425,2616.094196442287,22.831783477613463,68.91751962214617
51_9,Central Virginia,Virginia,0.0042099664419698495,3794.6698396318798,24.407888954247042,63.01507398188161
54_1,Region I Planning and Development Council,West Virginia,0.002701558436321848,1986.0537085945848,18.220398782282615,67.85312281342216
54_10,Region X - Bel-O-Mar Regional Council,West Virginia,0.003235280620439631,2948.4993804781793,24.103987884906612,70.46907727924155
54_11,Region XI - Brooke-Hancock Regional Planning and Development Council,West Virginia,0.002243639769002653,2315.4167316997036,17.929608240986422,69.07934166244064
54_2,Region II Planning and Development Council,West Virginia,0.0026170869350246365,1904.0927147801476,17.458612517688778,66.71500742942051
54_3,Region III - BCKP Regional Intergovernmental Council,West Virginia,0.003450806352978177,2004.1147589677287,21.316373420928485,70.77226469299313
54_4,Region IV Planning and Development Council,West Virginia,0.003453235254460741,4641.283015475887,22.494719022007818,66.18792054546594
54_5,Region V - Mid-Ohio Valley Regional Council,West Virginia,0.0029979088660378873,5244.514628684929,19.4493964086779,69.91173166425935
54_6,Region VI Planning and Development Council,West Virginia,0.0035437863403778875,3166.84048427096,21.196446447319314,64.71247747991556
54_7,Region VII Planning and Development Council,West Virginia,0.003170514217774695,2002.6931356565756,19.98684957171037,68.47540782534037
54_8,Region VIII Planning and Development Council,West Virginia,0.00217947619105925,1992.7269165309597,17.276634301037088,68.78177871606553
54_9,Region IX - Eastern Panhandle Regional Planning and Development Council,West Virginia,0.0026137800093673043,2312.208216032191,14.524357508700009,68.83244529512183
